{
  "id": "sample",
  "type": "sample",
  "links": {
    "self": "https://www.virustotal.com/gui/file/44d88612"
  },
  "attributes": {
    "url": "https://example.com/path",
    "final_url": "https://www.virustotal.com/gui/file/44d88612",
    "title": "sample",
    "first_submission_date": 1748534400,
    "last_submission_date": 1748534400,
    "last_analysis_date": 1748534400,
    "last_http_response_code": 200,
    "last_http_response_content_length": 1,
    "last_http_response_content_sha256": "aaaaaaaaaaaaaaaaaaaaaaaaaaaaaaaaaaaaaaaaaaaaaaaaaaaaaaaaaaaaaaaa",
    "last_http_response_headers": {},
    "last_http_response_cookies": {},
    "reputation": 1,
    "total_votes": {
      "harmless": 1,
      "malicious": 1
    },
    "last_analysis_stats": {
      "harmless": 1,
      "malicious": 1,
      "suspicious": 1,
      "undetected": 1,
      "timeout": 1748534400
    },
    "last_analysis_results": {},
    "categories": {},
    "tags": [
      "sample"
    ]
  },
  "relationships": {}
}