{
  "id": "sample",
  "type": "sample",
  "links": {
    "self": "https://www.virustotal.com/gui/file/44d88612"
  },
  "attributes": {
    "name": "Phishing",
    "stix_id": "sample",
    "description": "sample",
    "link": "https://www.virustotal.com/gui/file/44d88612",
    "tactics": [
      "sample"
    ]
  },
  "relationships": {}
}