{
  "id": "sample",
  "type": "sample",
  "links": {
    "self": "https://www.virustotal.com/gui/file/44d88612"
  },
  "attributes": {
    "name": "Emotet Campaign 2026-04",
    "description": "sample",
    "collection_type": "software-toolkit",
    "creation_date": 1748534400,
    "last_modification_date": 1748534400,
    "files_count": 42,
    "domains_count": 42,
    "ip_addresses_count": 42,
    "urls_count": 42,
    "owner": "sample",
    "tags": [
      "sample"
    ],
    "targeted_regions": [
      "sample"
    ],
    "targeted_industries": [
      "sample"
    ],
    "motivations": [
      "sample"
    ]
  },
  "relationships": {}
}