{
  "id": "sample",
  "type": "sample",
  "links": {
    "self": "https://www.virustotal.com/gui/file/44d88612"
  },
  "attributes": {
    "name": "Acme Corp SOC",
    "description": "sample",
    "country": "US",
    "domain": "example.com",
    "creation_date": 1748534400,
    "quotas": {},
    "preferences": {},
    "settings": {}
  },
  "relationships": {}
}