{
  "id": "sample",
  "type": "sample",
  "links": {
    "self": "https://www.virustotal.com/gui/file/44d88612"
  },
  "attributes": {
    "graph_data": {},
    "private": true,
    "creation_date": 1748534400,
    "last_modified_date": 1748534400,
    "user_count": 42,
    "owner": "sample",
    "comments_count": 42,
    "views_count": 42
  },
  "relationships": {}
}